{
  "schema_version": "1.0.0",
  "dataset": "worldmonitor-chokepoint-status",
  "snapshot_date": "2026-09-10",
  "generated_at": "2026-10-14T12:25:10.469Z",
  "source_url": "https://www.worldmonitor.app/api/supply-chain/v1/get-chokepoint-status",
  "source_fetched_at": "2026-09-10T06:50:30.970Z",
  "upstream_unavailable": false,
  "methodology_url": "https://www.worldmonitor.app/docs/methodology/chokepoints",
  "readme_url": "https://www.worldmonitor.app/data/v1/chokepoints/README.md",
  "license": {
    "proposed": "CC-BY-4.0",
    "status": "proposed-pending-owner-decision"
  },
  "attribution": "WorldMonitor (https://www.worldmonitor.app). Scores and statuses are computed by WorldMonitor from IMF PortWatch, NGA Maritime Safety Information, and AIS data via aisstream.io.",
  "chokepoints": [
    {
      "id": "bab_el_mandeb",
      "name": "Bab el-Mandeb",
      "lat": 12.58,
      "lon": 43.33,
      "status": "yellow",
      "disruption_score": 40,
      "war_risk_tier": "critical",
      "congestion_level": "normal",
      "active_warnings": 0,
      "ais_disruptions": 0,
      "navigational_warnings_available": true,
      "ais_snapshot_available": true,
      "transit_data_available": true,
      "transit_today_counts_available": false,
      "transit_today_total": null,
      "transit_today_tanker": null,
      "transit_today_cargo": null,
      "transit_today_other": null,
      "transit_wow_change_pct": -3.3,
      "flow_ratio": 0.572,
      "flow_disrupted": true,
      "flow_source": "portwatch-dwt"
    },
    {
      "id": "bosphorus",
      "name": "Bosporus Strait",
      "lat": 41.12,
      "lon": 29.05,
      "status": "yellow",
      "disruption_score": 30,
      "war_risk_tier": "elevated",
      "congestion_level": "high",
      "active_warnings": 0,
      "ais_disruptions": 1,
      "navigational_warnings_available": true,
      "ais_snapshot_available": true,
      "transit_data_available": true,
      "transit_today_counts_available": true,
      "transit_today_total": 1,
      "transit_today_tanker": 0,
      "transit_today_cargo": 0,
      "transit_today_other": 1,
      "transit_wow_change_pct": -11.2,
      "flow_ratio": 0.85,
      "flow_disrupted": false,
      "flow_source": "portwatch-dwt"
    },
    {
      "id": "cape_of_good_hope",
      "name": "Cape of Good Hope",
      "lat": -34.36,
      "lon": 18.49,
      "status": "green",
      "disruption_score": 15,
      "war_risk_tier": "normal",
      "congestion_level": "high",
      "active_warnings": 0,
      "ais_disruptions": 1,
      "navigational_warnings_available": true,
      "ais_snapshot_available": true,
      "transit_data_available": true,
      "transit_today_counts_available": false,
      "transit_today_total": null,
      "transit_today_tanker": null,
      "transit_today_cargo": null,
      "transit_today_other": null,
      "transit_wow_change_pct": -14.5,
      "flow_ratio": null,
      "flow_disrupted": null,
      "flow_source": null
    },
    {
      "id": "dover_strait",
      "name": "Dover Strait",
      "lat": 51.05,
      "lon": 1.45,
      "status": "yellow",
      "disruption_score": 30,
      "war_risk_tier": "normal",
      "congestion_level": "high",
      "active_warnings": 7,
      "ais_disruptions": 1,
      "navigational_warnings_available": true,
      "ais_snapshot_available": true,
      "transit_data_available": true,
      "transit_today_counts_available": true,
      "transit_today_total": 7,
      "transit_today_tanker": 3,
      "transit_today_cargo": 0,
      "transit_today_other": 4,
      "transit_wow_change_pct": 2,
      "flow_ratio": 0.97,
      "flow_disrupted": false,
      "flow_source": "portwatch-dwt"
    },
    {
      "id": "gibraltar",
      "name": "Strait of Gibraltar",
      "lat": 35.96,
      "lon": -5.35,
      "status": "green",
      "disruption_score": 15,
      "war_risk_tier": "normal",
      "congestion_level": "high",
      "active_warnings": 0,
      "ais_disruptions": 1,
      "navigational_warnings_available": true,
      "ais_snapshot_available": true,
      "transit_data_available": true,
      "transit_today_counts_available": true,
      "transit_today_total": 1,
      "transit_today_tanker": 0,
      "transit_today_cargo": 1,
      "transit_today_other": 0,
      "transit_wow_change_pct": 10,
      "flow_ratio": null,
      "flow_disrupted": null,
      "flow_source": null
    },
    {
      "id": "hormuz_strait",
      "name": "Strait of Hormuz",
      "lat": 26.56,
      "lon": 56.25,
      "status": "red",
      "disruption_score": 70,
      "war_risk_tier": "war_zone",
      "congestion_level": "normal",
      "active_warnings": 0,
      "ais_disruptions": 0,
      "navigational_warnings_available": true,
      "ais_snapshot_available": true,
      "transit_data_available": true,
      "transit_today_counts_available": false,
      "transit_today_total": null,
      "transit_today_tanker": null,
      "transit_today_cargo": null,
      "transit_today_other": null,
      "transit_wow_change_pct": -26.7,
      "flow_ratio": 0.122,
      "flow_disrupted": true,
      "flow_source": "portwatch-dwt"
    },
    {
      "id": "kerch_strait",
      "name": "Kerch Strait",
      "lat": 45.33,
      "lon": 36.6,
      "status": "red",
      "disruption_score": 70,
      "war_risk_tier": "war_zone",
      "congestion_level": "normal",
      "active_warnings": 0,
      "ais_disruptions": 0,
      "navigational_warnings_available": true,
      "ais_snapshot_available": true,
      "transit_data_available": true,
      "transit_today_counts_available": false,
      "transit_today_total": null,
      "transit_today_tanker": null,
      "transit_today_cargo": null,
      "transit_today_other": null,
      "transit_wow_change_pct": 0,
      "flow_ratio": null,
      "flow_disrupted": null,
      "flow_source": null
    },
    {
      "id": "korea_strait",
      "name": "Korea Strait",
      "lat": 34,
      "lon": 129,
      "status": "green",
      "disruption_score": 0,
      "war_risk_tier": "normal",
      "congestion_level": "normal",
      "active_warnings": 0,
      "ais_disruptions": 0,
      "navigational_warnings_available": true,
      "ais_snapshot_available": true,
      "transit_data_available": true,
      "transit_today_counts_available": false,
      "transit_today_total": null,
      "transit_today_tanker": null,
      "transit_today_cargo": null,
      "transit_today_other": null,
      "transit_wow_change_pct": -10.6,
      "flow_ratio": null,
      "flow_disrupted": null,
      "flow_source": null
    },
    {
      "id": "lombok_strait",
      "name": "Lombok Strait",
      "lat": -8.47,
      "lon": 115.72,
      "status": "green",
      "disruption_score": 0,
      "war_risk_tier": "normal",
      "congestion_level": "normal",
      "active_warnings": 0,
      "ais_disruptions": 0,
      "navigational_warnings_available": true,
      "ais_snapshot_available": true,
      "transit_data_available": true,
      "transit_today_counts_available": false,
      "transit_today_total": null,
      "transit_today_tanker": null,
      "transit_today_cargo": null,
      "transit_today_other": null,
      "transit_wow_change_pct": -6.9,
      "flow_ratio": null,
      "flow_disrupted": null,
      "flow_source": null
    },
    {
      "id": "malacca_strait",
      "name": "Strait of Malacca",
      "lat": 2.5,
      "lon": 101.5,
      "status": "green",
      "disruption_score": 15,
      "war_risk_tier": "normal",
      "congestion_level": "elevated",
      "active_warnings": 1,
      "ais_disruptions": 1,
      "navigational_warnings_available": true,
      "ais_snapshot_available": true,
      "transit_data_available": true,
      "transit_today_counts_available": false,
      "transit_today_total": null,
      "transit_today_tanker": null,
      "transit_today_cargo": null,
      "transit_today_other": null,
      "transit_wow_change_pct": 1.3,
      "flow_ratio": 0.804,
      "flow_disrupted": false,
      "flow_source": "portwatch-dwt"
    },
    {
      "id": "panama",
      "name": "Panama Canal",
      "lat": 9.08,
      "lon": -79.68,
      "status": "green",
      "disruption_score": 0,
      "war_risk_tier": "normal",
      "congestion_level": "normal",
      "active_warnings": 0,
      "ais_disruptions": 0,
      "navigational_warnings_available": true,
      "ais_snapshot_available": true,
      "transit_data_available": true,
      "transit_today_counts_available": false,
      "transit_today_total": null,
      "transit_today_tanker": null,
      "transit_today_cargo": null,
      "transit_today_other": null,
      "transit_wow_change_pct": 2.9,
      "flow_ratio": 1.096,
      "flow_disrupted": false,
      "flow_source": "portwatch-dwt"
    },
    {
      "id": "suez",
      "name": "Suez Canal",
      "lat": 30.45,
      "lon": 32.35,
      "status": "yellow",
      "disruption_score": 35,
      "war_risk_tier": "high",
      "congestion_level": "normal",
      "active_warnings": 1,
      "ais_disruptions": 0,
      "navigational_warnings_available": true,
      "ais_snapshot_available": true,
      "transit_data_available": true,
      "transit_today_counts_available": false,
      "transit_today_total": null,
      "transit_today_tanker": null,
      "transit_today_cargo": null,
      "transit_today_other": null,
      "transit_wow_change_pct": -3.3,
      "flow_ratio": 0.983,
      "flow_disrupted": false,
      "flow_source": "portwatch-dwt"
    },
    {
      "id": "taiwan_strait",
      "name": "Taiwan Strait",
      "lat": 24,
      "lon": 119.5,
      "status": "yellow",
      "disruption_score": 20,
      "war_risk_tier": "elevated",
      "congestion_level": "low",
      "active_warnings": 0,
      "ais_disruptions": 1,
      "navigational_warnings_available": true,
      "ais_snapshot_available": true,
      "transit_data_available": true,
      "transit_today_counts_available": true,
      "transit_today_total": 4,